{
  "job_id": "e2e-2026-06-09-live-es",
  "job_version": 1,
  "job_type": "media_pipeline",
  "title": "Nexetra E2E Validation Run",
  "duration_seconds": 60,
  "languages": ["en", "es"],
  "formats": ["16:9", "9:16", "1:1"],
  "style": "slides",
  "cta": "Visit nexetra.com",
  "stage_estimates_minutes": {
    "scriptgen": 0.4,
    "translate": 0.3,
    "tts": 0.2,
    "assembly": 0.5,
    "export": 0.5
  },
  "status": "live-test",
  "execution_policy": {
    "priority": "normal",
    "max_nodes": 2,
    "retry_budget": 1
  },
  "success_criteria": {
    "required_artifacts": ["{language}/script.json", "{language}/audio.wav", "{language}/{format}.mp4"],
    "minimum_language_completion": 2
  }
}
