{
  "job_id": "stress-thunderbolt-b",
  "job_version": 1,
  "job_type": "media_pipeline",
  "title": "Nexetra Multi-Market Stress B",
  "duration_seconds": 90,
  "languages": ["en", "es", "fr", "de", "pt", "ar", "hi", "ja", "zh"],
  "formats": ["16:9", "9:16", "1:1"],
  "style": "ai-visuals",
  "cta": "Launch your AI rollout with Nexetra",
  "stage_estimates_minutes": {
    "scriptgen": 0.9,
    "translate": 2.2,
    "tts": 1.8,
    "assembly": 2.0,
    "export": 2.0
  },
  "status": "stress-suite",
  "execution_policy": {
    "priority": "normal",
    "max_nodes": 9,
    "retry_budget": 1
  },
  "success_criteria": {
    "required_artifacts": ["{language}/script.json", "{language}/audio.wav", "{language}/{format}.mp4"],
    "minimum_language_completion": 9
  }
}
